{
  "artifact_type": "run_manifest",
  "schema_version": "1.0.0",
  "producer_version": "0.4.0",
  "rule_version": "narrative-lifecycle-rules-v0.1",
  "run_id": "run_20260712T173544742_d4eabc",
  "generated_at": "2026-07-12T17:35:44.742Z",
  "started_at": "2026-07-12T17:35:44.742Z",
  "artifact_version": "0.4.0",
  "completed_at": "2026-07-12T17:35:44.904Z",
  "status": "ok",
  "commands": [
    "pipeline",
    "diff",
    "report"
  ],
  "artifacts": [
    "outputs/runs/run_20260712T173544742_d4eabc/stage_snapshot.json",
    "outputs/runs/run_20260712T173544742_d4eabc/stage_diff.json",
    "outputs/runs/run_20260712T173544742_d4eabc/stage_diff.md",
    "outputs/runs/run_20260712T173544742_d4eabc/weekly_brief.json",
    "outputs/runs/run_20260712T173544742_d4eabc/weekly_brief.md"
  ],
  "previous_run_id": "run_20260712T173537955_891a89",
  "current_snapshot_id": "stage_snapshot_run_20260712T173544742_d4eabc",
  "previous_snapshot_id": "stage_snapshot_run_20260712T173537955_891a89",
  "guardrail_status": "ok"
}
