{
  "artifact_type": "run_manifest",
  "schema_version": "1.0.0",
  "producer_version": "0.4.0",
  "rule_version": "narrative-lifecycle-rules-v0.1",
  "run_id": "run_20260713T035057514_3ac02b",
  "generated_at": "2026-07-13T03:50:57.514Z",
  "started_at": "2026-07-13T03:50:57.514Z",
  "artifact_version": "0.4.0",
  "completed_at": "2026-07-13T03:50:57.680Z",
  "status": "ok",
  "commands": [
    "pipeline",
    "diff",
    "report"
  ],
  "artifacts": [
    "outputs/runs/run_20260713T035057514_3ac02b/stage_snapshot.json",
    "outputs/runs/run_20260713T035057514_3ac02b/stage_diff.json",
    "outputs/runs/run_20260713T035057514_3ac02b/stage_diff.md",
    "outputs/runs/run_20260713T035057514_3ac02b/weekly_brief.json",
    "outputs/runs/run_20260713T035057514_3ac02b/weekly_brief.md"
  ],
  "previous_run_id": "run_20260713T032841770_1f2f1f",
  "current_snapshot_id": "stage_snapshot_run_20260713T035057514_3ac02b",
  "previous_snapshot_id": "stage_snapshot_run_20260713T032841770_1f2f1f",
  "guardrail_status": "ok"
}
