{
  "artifact_type": "run_manifest",
  "schema_version": "1.0.0",
  "producer_version": "0.4.0",
  "rule_version": "narrative-lifecycle-rules-v0.1",
  "run_id": "run_20260712T172145560_a4b892",
  "generated_at": "2026-07-12T17:21:45.560Z",
  "started_at": "2026-07-12T17:21:45.560Z",
  "artifact_version": "0.4.0",
  "completed_at": "2026-07-12T17:21:45.731Z",
  "status": "ok",
  "commands": [
    "pipeline",
    "diff",
    "report"
  ],
  "artifacts": [
    "outputs/runs/run_20260712T172145560_a4b892/stage_snapshot.json",
    "outputs/runs/run_20260712T172145560_a4b892/stage_diff.json",
    "outputs/runs/run_20260712T172145560_a4b892/stage_diff.md",
    "outputs/runs/run_20260712T172145560_a4b892/weekly_brief.json",
    "outputs/runs/run_20260712T172145560_a4b892/weekly_brief.md"
  ],
  "previous_run_id": "run_20260712T172137443_0d28be",
  "current_snapshot_id": "stage_snapshot_run_20260712T172145560_a4b892",
  "previous_snapshot_id": "stage_snapshot_run_20260712T172137443_0d28be",
  "guardrail_status": "ok"
}
